<?xml version='1.0' encoding='UTF-8' ?>
<!DOCTYPE yawl SYSTEM 'file:///home/c30/.safet/dtd/yawlworkflow.dtd'>
<!--
Documento  : ConvenioOperadora.xml
Creado     : 27/10/2015 09:27 AM
Autor      : Josè Sulbaràn
Descripcion: Archivo generado por plantilla de la Libreria SAFET
-->


<yawl version="0.01">
 <workflow id="operadora_declaracion">
<token keysource="operadora_operadora" key="razon_social"/>
  
 <parameter title="Id"  type="string" mandatory="si"/>

  <!-- ################################################# -->

  <condition type="start" id="inicial">
   <port side="forward" type="split">
   <connection query=" select usuario_operadora_id from operadora_operadora" options="{#Id}" source="Operadora"
      tokenlink=""/>
   </port>
  </condition>
  

  <!-- ################################################ -->

  <task title="" id="Operadora"> 
   <port side="forward" type="split">
    
   
    <connection query=" select operadora_declaracion.moroso from operadora_operadora" options="true" source="Moroso"
      tokenlink="[usuario_operadora_id,operadora_id:operadora_declaracion][recaudacion_id,id:operadora_recaudacion]"/>


   </port>

  <variable config="1" documentsource="select rif from operadora_operadora" 
    type="sql" tokenlink=""  id="vOperadora" rolfield="" scope="task" timestampfield=""/>
  </task>

  <!-- ################################################ -->

  
  <task title="" id="Moroso"> 
   <port side="forward" type="split">
    
   <connection query="true" options="" source="final"/>
     
   </port>

  <variable config="1" documentsource="select distinct operadora_recaudacion.num_periodo from operadora_operadora" type="sql" 
    tokenlink="[usuario_operadora_id,operadora_id:operadora_declaracion][recaudacion_id,id:operadora_recaudacion]" 
    id="vMoroso" rolfield="" scope="task"
    timestampfield="" groupby= "order by num_periodo"/>
  </task>

  <!-- ################################################ -->

  <condition id="final">
   <port side="forward" type="split">
    <connection source=""/>
   </port>
  </condition>

  
 </workflow>
 <configuration id="1" connectstring="psql:seguridad.cenditel.gob.ve:ticket:vbravo:vbravo_"/>
</yawl>
