<?xml version="1.0" encoding="UTF-8" ?>
<!--
Documento  : tickets.xml
Creado     : 16/10/08 09:27 AM
Autor      : nombre_autor
Descripcion: Archivo generado por plantilla de la Libreria SAFET
-->

<!--<!DOCTYPE yawl SYSTEM "http://trac-safet.cenditel.gob.ve/dtd/yawlworkflow.dtd">-->
<!DOCTYPE yawl SYSTEM "file:///home/vbravo/.safet/dtd/yawlworkflow.dtd">
<yawl  version="0.01">
<workflow id="Generar planilla de solicitud de vista_vacaciones" desc="Planilla que se generar con los datos de una solicitud de vista_vacaciones">
<token key="id"  keysource="vista_vacaciones">
</token>

    
<condition id="inicial" type="start">
	<port side="forward" type="split"  >
		<connection   source="Iniciado" query="select status from vista_vacaciones"  options="iniciado" tokenlink="" >
		</connection>
	</port>
</condition>

<task id="Iniciado"  title="todas" >
	<port side="forward" type="split"  >
		<connection   source="TalentoHumano" query="select status from vista_vacaciones"  options="TalentoHumano" tokenlink="" >
		</connection>

	</port>
	 <variable id="vSolicitud" scope="task"  type="sql" config="1"   tokenlink="" 
                documentsource="select id_cedula from vista_vacaciones"
 

 >
     </variable>
</task>
<task id="TalentoHumano"  title="todas" >
	<port side="forward" type="split"  >
		<connection   source="Direccion" query="select status from vista_vacaciones"  options="Direccion" tokenlink="" >
		</connection>

	</port>
	 <variable id="vTalentoHumano" scope="task"  type="sql" config="1"   tokenlink="" 
                documentsource="select id_cedula from vista_vacaciones"
rolfield="(select nombre_periodo from vacaciones_registro where vacaciones_registro.id_vacaciones=vista_vacaciones.id and vacaciones_registro.status='TalentoHumano' limit 1)"  timestampfield="(select fecha_accion from vacaciones_registro where vacaciones_registro.id_vacaciones=vista_vacaciones.id and vacaciones_registro.status='TalentoHumano' limit 1)" 

 >
     </variable>
</task>

<task id="Direccion"  title="Planilla vista_vacaciones" >
	<port side="forward" type="split"  >
	    <connection source="Presidencia" query="select status from vista_vacaciones" options="Presidencia" >
        </connection>
	</port>
	 <variable id="vDireccion" scope="task"  type="sql" config="1"   tokenlink=""
                 documentsource="select id_cedula from vista_vacaciones"
 rolfield=""  timestampfield="" 


 >
     </variable>
</task>
<task id="Presidencia"  title="Aprobacion del Presidente" >
	<port side="forward" type="split" pattern="none" >
		<connection source="Archivar_solicitud_procesada" query="select status from vista_vacaciones" options="Archivar_solicitud_procesada" tokenlink="" >

		</connection>
	</port>
	 <variable id="vPresidencia" scope="task"  type="sql" config="1"   tokenlink=""
                 documentsource="select id_cedula, nombreapellido from vista_vacaciones"
 rolfield=""  timestampfield="" 

 >
     </variable>
</task>
<task id="Archivar_solicitud_procesada"  title="solicitud_archivada" >
	<port side="forward" type="split"  >
		<connection source="final" query="true" options="" tokenlink="" >

		</connection>

	</port>
	 <variable id="vArchivar" scope="task"  type="sql" config="1"   tokenlink=""
                 documentsource="select id_cedula, nombreapellido, diasadisfrutar, diasdisfrutados, diassolicitados, diaspordisfrutar, fechasolicitud, fechainicio, fechafin, suplenteinterno_1, suplenteinterno_2, cedula_suplente_1, cedula_suplente_2, vista_vacaciones.cargo, vista_vacaciones.fecha_ingreso, nombre, vista_vacaciones.departamento, cargo_1, cargo_2, vista_vacaciones.fechaincorporacion, fechafin, diasinhabiles, diasadicionales, bonoacancelar, sueldodelmes, sueldoanticipado, totalapagar, observaciones_talento_humano, observaciones_direccion_ejecutiva, observaciones_presidencia from vista_vacaciones"
 rolfield=""  timestampfield="" 
 >
     </variable>
</task>
<condition id="final">
	<port side="forward" type="split">
		<connection source="">
		</connection>
	</port>
</condition>
</workflow>
	<configuration id="1" connectstring="psql:seguridad.cenditel.gob.ve:ticket:vbravo:vbravo_">
	</configuration>
</yawl>

